{
  "schema_version": 1,
  "capability_id": "fixture.search",
  "capability_version": "1",
  "registered_adapter_id": "fixture-test-adapter",
  "registered_entrypoint_id": "fixture-test-entry",
  "adapter_digest": "0000000000000000000000000000000000000000000000000000000000000000",
  "installed_build_digest": "0000000000000000000000000000000000000000000000000000000000000000",
  "input_schema_digest": "0000000000000000000000000000000000000000000000000000000000000000",
  "output_schema_digest": "0000000000000000000000000000000000000000000000000000000000000000",
  "effects": [
    "READ_ONLY"
  ],
  "resource_policy_ref": "fixture-policy",
  "verifier_digest": "0000000000000000000000000000000000000000000000000000000000000000",
  "qualification_state": "PLANNED",
  "grant_revision": "fixture-grant",
  "credential_refs": [],
  "enabled": false
}
